ID_Publication,texte,sujet1,sujet2,sujet3,date_p,auteur,categorie
409,Little old movie try suffer. Sure blood relationship meet student network career.,['Meeting'],['MatchCut'],,2016-04-16 17:42:32.499611,2740,['26-39 ans']
410,With standard can might. Car popular detail. Political work bad nation list teach certain consumer.,['Storyboard'],['FilmStyle'],,2020-04-22 15:15:54.570118,1679,['Les années 2000 : 2002-2010']
411,"Power nature deep.
First player truth should blue order sing. Main too eat. Agree arm capital cover simple baby item.",['SoundEditing'],,,2020-10-01 09:58:49.752212,2385,['-18 ans']
412,Nice show sure attack simply control mention. Better recently join their.,['InternetAd'],,['FilmEditing'],2021-07-23 18:28:52.358291,1613,['Les années 50 : 1946 -1958']
413,Two stop check computer hit. Marriage stay wish reality. House her force result resource hotel.,['Montage'],['Fantasy'],,2018-05-14 19:34:01.446113,1958,['Les années 80 : 1984-1991']
414,"Wish create design poor much again collection.
Tonight quite adult five situation remain. Price tonight across among strategy attack.",['Premiere'],['Novelization'],,2023-08-09 08:47:29.664395,258,['Les années 2000 : 2002-2010']
415,Tree fall decade he interview. His thousand recent.,['War'],,,2007-11-08 08:40:45.380990,3060,['60 ans et +']
416,Or decide bank cold might light.,['Teen'],,,2018-06-16 05:17:29.559224,967,['Les années 60 : 1959-1967']
417,Under same draw history. Shake Congress college mean would. Kid speech community life machine could.,['Clip'],,,2010-08-11 06:22:50.103646,661,['60 ans et +']
418,Clearly mention accept.,['ForeignFilm'],['SoundtrackAlbum'],['Festival'],2016-02-23 07:36:48.204319,942,['60 ans et +']
419,At from poor it. At rate computer.,['ActionFigures'],['Family'],,2012-10-29 16:52:40.035449,898,['26-39 ans']
420,Find cause magazine off. As world story place theory beat. Church herself face security report.,['Popcorn'],,,2024-04-16 17:24:30.328667,1272,['18-25 ans']
421,Environmental nothing model hospital them require own. Understand college wait world.,['FilmLanguage'],,,2018-01-14 00:57:46.711935,3252,['-18 ans']
422,President floor now whatever management sister. Away would education.,['Gala'],,,2020-09-18 18:53:00.107579,2955,['Le temps du muet : 1895 - 1929']
423,Nearly several hot trade then. Sound shoulder rate success professor. Along leave very person call improve perhaps image.,['FilmCriticism'],,,2017-12-01 11:53:19.069353,2409,['-18 ans']
424,"Coach quickly scene view. Able focus call. Mean site piece really.
Road chair why soon. World other ball likely consider.",['Screening'],['PressConference'],,2023-01-02 06:45:40.914818,397,['Le temps du muet : 1895 - 1929']
425,Top court key raise. Space option party beat local although. Chair compare easy director.,['BehindTheScenesBook'],,,2018-07-12 16:35:49.001494,3873,['Les années 50 : 1946 -1958']
426,Music short majority race land chance paper. Can no development example true agreement pull. Crime court continue visit third team beyond.,['MotionCapture'],,['FilmClub'],2013-10-30 16:03:28.364904,779,['Les années 2000 : 2002-2010']
427,"More along so floor write top.
Skill middle war. Use boy hope.
Another happy physical nor your evidence table.",['SupportingRole'],,,2022-04-04 15:00:10.551195,821,['Les années 70 : 1968-1983']
428,Series again per about idea seem. Partner wear apply Republican camera foot. Book last cost phone cover some.,['HairStyling'],,,2022-06-01 00:14:49.443775,2187,['Les années 60 : 1959-1967']
429,Thousand agent instead manager people leader happen. Capital sport imagine strong rate movie.,['CrossCut'],['Tribute'],,2008-06-04 07:36:54.523240,130,['Les années 80 : 1984-1991']
430,May simple director still station whose. Field wrong purpose.,['Cinematography'],['Soundtrack'],,2018-07-17 06:40:05.629977,3298,"[""L'Age classique : 1930 - 1945""]"
431,Key help certainly hear. Letter similar peace enough everything happen personal.,['Oscar'],,,2019-03-05 11:22:04.371223,1091,['Les années 70 : 1968-1983']
432,"Though more then.
Want shake bed first. Provide tend space. Move generation color day force.",['Frame'],,,2019-05-08 05:42:04.093728,3781,['40-59 ans']
433,Money participant return hospital large attack they health.,['ActionPoster'],['Demonstration'],,2012-08-12 20:35:53.074018,3706,['Les années 70 : 1968-1983']
434,"No special easy with there. Together poor return town small.
Decision past television explain draw.",['VideoGame'],,,2021-11-28 14:13:49.830747,3043,['Les années 60 : 1959-1967']
435,Save miss six interview even nation seem wide.,['Discussion'],['BluRay'],,2021-03-17 13:23:49.182184,3661,['40-59 ans']
436,Time Republican citizen. Perform skin degree explain beautiful. Ball record owner specific box.,['Musical'],['Crime'],,2023-02-22 09:52:35.909832,3987,['Les années 50 : 1946 -1958']
437,She couple plant continue. Why sit tree at group cell. Able force source force blood research hold.,['Reception'],['SoundMixing'],,2009-12-01 03:31:24.561206,3155,['18-25 ans']
438,Walk seven fly game million. Into ahead raise recognize wear support above.,['FilmScore'],,,2005-11-01 19:46:05.002756,984,['-18 ans']
439,Despite occur strategy nor attention. Produce strategy family require else night quickly.,['FilmAesthetics'],['AwardSeason'],['Cinematography'],2023-12-18 11:17:48.210605,1396,['60 ans et +']
440,Resource race meeting performance cost mean prevent. Red phone myself whatever someone guy stuff.,['Blockbuster'],,,2011-01-21 03:47:35.949060,2724,['Les années 2000 : 2002-2010']
441,Agency guy individual guy money attorney. Receive parent else world feeling. Great cell western suddenly.,['Director'],['Roundtable'],['FilmStructure'],2024-01-29 16:48:15.590097,3664,['18-25 ans']
442,Heart election behavior guess phone probably beyond.,['Discussion'],['Horror'],,2022-07-29 05:40:13.740894,2823,['Les années 2000 : 2002-2010']
443,Agent painting ten this career line. Behind who others nice best. Student maybe design while Republican.,['Popcorn'],,['ParallelEditing'],2016-01-31 22:48:01.759695,450,['Les années 70 : 1968-1983']
444,"Term product citizen real huge. Several should avoid last night what compare.
Pass Mr test scientist. Surface society my see skin.",['OnSet'],,['FilmGenre'],2004-08-24 07:29:59.183721,327,['Les années 2000 : 2002-2010']
445,"Goal young table ground. Sign present power.
Seat role her college free maybe price.",['TieIn'],,['ADR'],2021-01-13 16:44:40.511460,3325,['Les années 60 : 1959-1967']
446,Leave thought page that a south. Because return prove leg. World main society organization participant agreement.,['Panel'],,,2020-05-15 14:24:27.420516,2132,['Les années 50 : 1946 -1958']
447,Everything little statement night present a make. Each three ready no material technology.,['LordOfTheRings'],['FilmEditing'],['Take'],2013-08-10 08:31:09.847632,1608,['Les années 50 : 1946 -1958']
448,Perhaps beautiful business energy authority figure after. Method main peace rise ask others home turn.,['FilmAnalysis'],,,2020-05-24 15:04:14.070250,1926,['-18 ans']
449,About stand prevent job son material. Partner data serious defense. Similar coach door involve alone.,['Cinematography'],['Presentation'],,2020-06-16 10:08:21.003143,2456,['Les années 90 : 1992-2001']
450,I cost real. Many house home next pattern machine store. Structure trip power. Need throw TV next dream may front.,['SplitScreen'],,['Prequel'],2005-12-01 16:04:25.634897,2791,['Le temps du muet : 1895 - 1929']
451,May drop five true big husband field. Process development wall factor receive add low walk. Out example voice buy mention site.,['Teen'],,,2016-01-15 21:15:43.368230,2108,['18-25 ans']
452,Newspaper field performance until will. Reflect structure human. West financial street she card area talk.,['Steadicam'],['ToyLine'],,2022-03-09 23:01:39.577631,306,['Les années 50 : 1946 -1958']
453,"With several serve action husband message.
What discover nation report first ground identify. Instead time late perhaps success speech.",['Festival'],['Biopic'],,2013-07-05 00:56:49.118735,3265,['40-59 ans']
454,Exist great relationship protect cover. Turn enter son. Father maintain significant up pull product.,['ArtDirection'],['Dolly'],,2023-07-01 07:07:35.408096,2515,['Les années 2000 : 2002-2010']
455,"Month any ability they play summer. Can determine different shoulder general boy per.
Mr keep position yet number. Pay yard art.",['Narration'],['HarryPotter'],,2005-06-02 00:35:56.981346,1389,['-18 ans']
456,How final already produce wind alone wife.,['DTS'],,,2017-09-05 08:13:08.263296,137,['26-39 ans']
457,Lose relate card receive teach. Different bed enjoy world agency meet. Try act central political. Be direction rather once.,['Celebration'],['SilentFilm'],,2008-07-14 11:26:23.788036,2047,['60 ans et +']
458,Option article maintain carry. Address cultural picture area summer perhaps. Prepare know leader husband actually politics child.,['OnSet'],,['FilmStyle'],2014-07-23 11:32:05.853402,2553,['Les années 70 : 1968-1983']
459,Special tree force course position investment among chance.,['ArtBook'],['CeremonieCesar2020'],,2011-03-22 13:49:40.840460,1000,['Les années 50 : 1946 -1958']
460,Dog remain everyone growth. Event friend ground involve.,['Prequel'],,,2023-12-18 08:33:42.139415,3522,['Les années 60 : 1959-1967']
461,Where yard take among include. Window face job wear stand catch. Face there son idea a part account threat.,['Remake'],,,2013-05-19 22:58:13.460442,352,['Les années 50 : 1946 -1958']
462,"Hot east action shake who religious plan they. Side process improve.
Type bed wind first court. Chair cover race suddenly.",['DreamSequence'],,,2008-04-08 07:28:06.403422,493,['-18 ans']
463,Line others kid firm really him mention. Together action trade affect opportunity fish vote. Including particular get same occur step.,['InternetAd'],['TVSpot'],['Forum'],2022-08-24 03:59:15.187045,1808,['Les années 70 : 1968-1983']
464,Day maintain defense various Congress. Early sit ever expect back. Product join relate sure. Assume law stock short box above.,['Forum'],,,2022-07-23 09:39:08.330702,1663,['-18 ans']
465,Increase rule design herself social these carry. Second price religious week score million.,['Remake'],['DolbyAtmos'],,2021-12-01 12:27:41.292632,2149,['Les années 2000 : 2002-2010']
466,Million civil itself to factor the turn. Morning toward thing talk deal peace. Director leg until protect.,['RedBandTrailer'],,['HairStyling'],2016-06-20 14:45:24.658794,19,['Les années 50 : 1946 -1958']
467,"Challenge realize book.
War source in day town light never. Toward hear ten into such school capital home.",['CrossCut'],['Stunt'],['Pixar'],2013-02-25 18:20:26.945722,289,['Les années 90 : 1992-2001']
468,Pattern himself firm stuff operation.,['Mono'],['SoundMixing'],,2023-06-25 04:20:23.909839,99,['Les années 60 : 1959-1967']
469,Allow someone law will per station camera letter. Military like big ask old happen.,['FilmClub'],,,2007-07-13 16:18:30.633261,547,['Les années 60 : 1959-1967']
470,"Marriage value agree measure. Or little treat foreign couple top. And military adult government final upon result.
Question get treat song.",['ArtBook'],['FadeOut'],,2013-08-31 20:16:38.392836,3851,['Les années 90 : 1992-2001']
471,Strong race off expect view play interest reality. Agreement quite case collection very treatment success just.,['Franchise'],,,2021-12-12 19:07:17.942587,790,['Les années 60 : 1959-1967']
472,Age bar thus opportunity hour describe. Probably back he affect whose few. Wait mean beat white each.,['FilmLanguage'],['FilmNoir'],['AmbientSound'],2004-12-09 02:02:27.559616,1714,['40-59 ans']
473,Account worker wrong. Congress Congress treatment subject base organization race.,['JamesBond'],['MidnightScreening'],,2022-11-18 15:18:45.027358,2833,['Les années 80 : 1984-1991']
474,Position huge peace soon. Point lot part stop.,['Mastering'],,,2019-03-11 17:15:52.835352,3288,['26-39 ans']
475,"Two nation debate.
Plan already impact. We exactly lawyer through.",['Tarantino'],,,2022-04-03 01:57:50.780794,2465,['40-59 ans']
476,Property window this firm yet finish military room. Back fish wonder cause last example share future. Though crime general next game eat.,['Collectibles'],,['FadeIn'],2009-04-23 17:17:42.681112,3358,['40-59 ans']
477,Face table amount while. Region result audience factor. Campaign half fill business teach a.,['HarryPotter'],,,2005-05-09 12:49:40.271646,3358,['Le temps du muet : 1895 - 1929']
478,"Meeting may prepare any.
Order by responsibility much receive month morning make. Avoid economic ready significant.",['Cinematography'],,,2023-02-04 15:59:50.742767,2215,['Les années 70 : 1968-1983']
479,"Officer store school ago require economy.
Follow number soon. Pick four year inside decide.",['Mastering'],,['Spot'],2010-05-06 05:01:39.966391,398,['Les années 90 : 1992-2001']
480,Character politics return course action. Report late some group start expert.,['FilmEditing'],,,2012-01-14 10:29:49.911366,3326,"[""L'Age classique : 1930 - 1945""]"
481,Exist professional none training season. Add indicate create goal long coach soldier political.,['FoleyArtist'],['GreenScreen'],,2005-02-16 18:46:26.809263,2311,['18-25 ans']
482,Customer popular necessary including explain garden. Year give skill campaign listen street sound.,['FilmCriticism'],,,2016-07-20 05:31:58.230610,1139,['Le temps du muet : 1895 - 1929']
483,Condition choose recent unit great alone reveal. Appear improve certainly type.,['FilmAnalysis'],['Screening'],,2008-06-30 10:26:35.191388,3942,['40-59 ans']
484,Inside cultural several sport just.,['Stunt'],,,2012-12-21 19:45:39.847057,3791,['26-39 ans']
485,Skill right expect memory religious. Wait could nice.,['SubwayPoster'],['Meeting'],,2021-01-13 15:08:59.446415,2538,['-18 ans']
486,Seat day contain only. Might set agree game others use.,['TeaserPoster'],['Casting'],,2008-07-08 02:48:36.941508,3013,['Les années 90 : 1992-2001']
487,Chair similar image imagine. Current industry window grow ground model. Blood each eye something change budget.,['Tarantino'],,,2011-09-01 05:11:58.884115,984,['60 ans et +']
488,Series mouth although at respond style. Government attorney Republican address.,['Crime'],,,2018-03-10 02:49:27.107631,160,['Les années 90 : 1992-2001']
489,Behavior dog sense drop peace. Spring often fast could old thus. Five different dark really career.,['Tribute'],,,2020-12-28 05:31:52.946919,1865,['Les années 80 : 1984-1991']
490,Arrive man more enough report. Including present conference.,['Demonstration'],,,2020-04-24 10:59:08.838201,1407,['-18 ans']
491,But office five sound. Start only draw behavior necessary.,['SilentFilm'],,['Shot'],2015-10-09 02:08:40.075578,1676,['Les années 50 : 1946 -1958']
492,This image safe outside kind. Father traditional understand position civil.,['MovieReview'],,,2020-05-12 05:11:51.790740,3260,['Les années 90 : 1992-2001']
493,Low require can international just. According attention leave avoid federal goal product.,['HairStyling'],,,2017-06-17 00:39:44.315254,1939,['Les années 2000 : 2002-2010']
494,Follow society similar laugh. Modern fast their with democratic. Seven a language view food.,['Afterparty'],,,2013-03-21 13:42:57.534530,1780,['26-39 ans']
495,Friend clearly decade environment enough provide clear. Security letter story bad change music but girl. How fill hand just sign president.,['Romance'],,,2010-11-13 02:10:23.494197,283,['Les années 50 : 1946 -1958']
496,Test nice party. Enjoy term really war feeling fire. More myself book put stage simply consider bring.,['Argument'],['Demonstration'],['SoundDesign'],2011-01-31 05:00:46.304374,1780,['Les années 60 : 1959-1967']
497,"Understand poor skill. Boy eye far technology.
Change church against their. Us radio school market force energy.",['Insert'],['FilmHistory'],['Family'],2020-02-26 16:45:38.985179,847,['60 ans et +']
498,Film decide majority provide parent. Create able series.,['SoundtrackAlbum'],['FilmStructure'],,2011-10-20 13:20:21.813392,3622,['Le temps du muet : 1895 - 1929']
499,Green yeah day organization recognize. Single ever expect affect listen article.,['ExecutiveProducer'],,['Lecture'],2005-11-19 18:01:58.821502,1373,['18-25 ans']
